{
  "schema_version": 1,
  "source_kind": "numeric_time_series",
  "candidate_id": "private.voltage.word10",
  "candidate_source_kind": "private_interface",
  "value_unit": "V",
  "locator": {
    "operation_id": "nvapi.voltage.word10",
    "offset_bytes": 40,
    "width_bytes": 4,
    "endianness": "little",
    "signed": false,
    "scale": 0.000001,
    "addend": 0
  },
  "hypothesis": "Profile-scoped raw word may track the external voltage reference.",
  "alternative_hypotheses": [
    "The word may encode a limit, target, or unrelated status field."
  ],
  "limitations": [
    "Synthetic fixture for deterministic analyzer coverage; it is not hardware identity evidence."
  ],
  "samples": [
    { "monotonic_ns": 0, "value": 0 },
    { "monotonic_ns": 1000000000, "value": 0 },
    { "monotonic_ns": 2000000000, "value": 1 },
    { "monotonic_ns": 3000000000, "value": 2 },
    { "monotonic_ns": 4000000000, "value": 3 },
    { "monotonic_ns": 5000000000, "value": 2 },
    { "monotonic_ns": 6000000000, "value": 1 },
    { "monotonic_ns": 7000000000, "value": 0 }
  ],
  "reference": {
    "name": "synthetic_external_reference",
    "unit": "V",
    "samples": [
      { "monotonic_ns": 0, "value": 0 },
      { "monotonic_ns": 1000000000, "value": 1 },
      { "monotonic_ns": 2000000000, "value": 2 },
      { "monotonic_ns": 3000000000, "value": 3 },
      { "monotonic_ns": 4000000000, "value": 2 },
      { "monotonic_ns": 5000000000, "value": 1 },
      { "monotonic_ns": 6000000000, "value": 0 },
      { "monotonic_ns": 7000000000, "value": 0 }
    ]
  }
}
